{"actors": {"attacker": "anvil:0", "victim": "0xaaaaaaaaaaaaaaaaaaaaaaaaaaaaaaaaaaaaaaaa"}, "final_assertions": [], "finding_id": "F-g1", "spec_id": "SEQ-TEST-04", "steps": [{"actor": "attacker", "args": ["1"], "expect_revert": false, "function": "deposit(uint256)", "step": 1, "target": "0xcdcdcdcdcdcdcdcdcdcdcdcdcdcdcdcdcdcdcdcd"}, {"actor": "victim", "expect_revert": false, "function": "drain()", "step": 2, "target": "0xcdcdcdcdcdcdcdcdcdcdcdcdcdcdcdcdcdcdcdcd"}]}