{"actors": {"attacker": "anvil:0", "victim": "0xbbbbbbbbbbbbbbbbbbbbbbbbbbbbbbbbbbbbbbbb"}, "final_assertions": [{"account": "attacker", "id": "A1", "kind": "balance", "op": ">=", "value": "2000"}, {"id": "A2", "kind": "storage", "op": "==", "slot": "5", "target": "0xcdcdcdcdcdcdcdcdcdcdcdcdcdcdcdcdcdcdcdcd", "value": "18446744073709551616"}], "finding_id": "F-run1", "spec_id": "SEQ-TEST-02", "steps": [{"actor": "attacker", "args": ["1000"], "expect_revert": false, "function": "deposit(uint256)", "step": 1, "target": "0xcdcdcdcdcdcdcdcdcdcdcdcdcdcdcdcdcdcdcdcd"}, {"actor": "victim", "expect_revert": true, "function": "claim()", "mine_blocks": 3, "step": 2, "target": "0xcdcdcdcdcdcdcdcdcdcdcdcdcdcdcdcdcdcdcdcd"}]}