{"actors": {"attacker_2": "anvil:2", "deployer": "anvil:007", "victim": "0x1212121212121212121212121212121212121212"}, "final_assertions": [{"account": "0x1212121212121212121212121212121212121212", "id": "A1", "kind": "balance", "op": "<=", "value": "0"}, {"args": ["7"], "function": "get()", "id": "A2", "kind": "call", "op": "!=", "target": "0xcdcdcdcdcdcdcdcdcdcdcdcdcdcdcdcdcdcdcdcd", "value": "123456789012345678901234567890"}], "finding_id": "F-edge", "spec_id": "SEQ-EDGE-01", "steps": [{"actor": "deployer", "args": ["a b", "0x00", "it's", "$HOME", ""], "expect_revert": false, "function": "init(string,uint256)", "mine_blocks": 0, "step": 1, "target": "0xcdcdcdcdcdcdcdcdcdcdcdcdcdcdcdcdcdcdcdcd"}, {"actor": "victim", "args": [], "expect_revert": false, "function": "claim()", "step": 2, "target": "0xcdcdcdcdcdcdcdcdcdcdcdcdcdcdcdcdcdcdcdcd"}, {"actor": "attacker_2", "expect_revert": false, "function": "sweep()", "mine_blocks": 12, "step": 3, "target": "0xcdcdcdcdcdcdcdcdcdcdcdcdcdcdcdcdcdcdcdcd"}]}